{
  "job_id": "job_01J9ZB5Q2K",
  "request_id": "0192b4d6-5d2a-7c4e-9a10-4b2f1e8c7d01",
  "attempt": 1,
  "workflow": { "key": "instagram_photo", "version": "1.0.0" },
  "state": "cancelled",
  "progress": null,
  "created_at": "2026-10-18T10:00:00Z",
  "started_at": "2026-10-18T10:00:03Z",
  "finished_at": "2026-10-18T10:00:09Z",
  "outputs": [],
  "error": { "code": "CANCELLED", "class": "cancelled", "message": "cancelled by platform", "retryable": false },
  "resource_usage": null,
  "engine": { "engine_id": "ws01-comfyui", "engine_version": "0.1.0" }
}
